<?xml version="1.0"?>
<launch name="stdin_launch" xmlns:xsi="http://www.w3.org/2001/XMLSchema-instance" xsi:noNamespaceSchemaLocation="http://matt5sean3.com/launch.xsd">
  <node name="stdin" xsi:type="script_t">
    <path os="linux" absolute="false">
      <directory>scripts</directory>
      <directory>main.pl</directory>
    </path>
    <interpreter name="perl_interpreter">
      <path os="linux" absolute="true">
        <directory>usr</directory>
        <directory>bin</directory>
        <directory>perl</directory>
      </path>
    </interpreter>
  </node>
</launch>
