<?xml version="1.0"?>
<launch xmlns:xsi="http://www.w3.org/2001/XMLSchema-instance" xsi:noNamespaceSchemaLocation="http://matt5sean3.com/launch.xsd">
  <executable xsi:type="script_t">
    <path absolute="false" os="linux">
      <directory>..</directory>
      <directory>script</directory>
      <directory>main.pl</directory>
    </path>
    <interpreter>
      <path absolute="true" os="linux">
        <directory>usr</directory>
        <directory>bin</directory>
        <directory>perl</directory>
      </path>
    </interpreter>
  </executable>
</launch>
