<?xml version="1.0"?>
<launch name="linkage_launch" xmlns:xsi="http://www.w3.org/2001/XMLSchema-instance" xsi:noNamespaceSchemaLocation="http://matt5sean3.com/launch.xsd">
  <node name="from" xsi:type="script_t">
    <path os="linux" absolute="false">
      <directory>scripts</directory>
      <directory>from.py</directory>
    </path>
    <interpreter name="python_interpreter">
      <path os="linux" absolute="true">
        <directory>usr</directory>
        <directory>bin</directory>
        <directory>python</directory>
      </path>
    </interpreter>
  </node>
  <node name="to" xsi:type="script_t">
    <path os="linux" absolute="false">
      <directory>scripts</directory>
      <directory>to.py</directory>
    </path>
    <interpreter name="python_interpreter">
      <path os="linux" absolute="true">
        <directory>usr</directory>
        <directory>bin</directory>
        <directory>python</directory>
      </path>
    </interpreter>
  </node>
  <linkage from="from" to="to" />
</launch>
